{
  "schema_version": "0.2.0",
  "language": "en",
  "extraction_assessment": {
    "status": "complete",
    "limitations": []
  },
  "article_metrics": {
    "evidence_coverage": {
      "status": "present",
      "rationale": "The article supports the decision with attendance records, a visitor survey, cost information, and a stated plan to review the change.",
      "paragraph_ids": ["p1", "p2", "p3", "p5", "p8"]
    },
    "source_traceability": {
      "status": "present",
      "rationale": "Readers can distinguish the library's records, the visitor survey, the director's explanation, and the council member's position.",
      "paragraph_ids": ["p2", "p3", "p4", "p6"]
    },
    "causal_support": {
      "status": "not_applicable",
      "rationale": "The article makes no material cause-and-effect claim; it explicitly says later hours are not established as the sole cause of the attendance increase.",
      "paragraph_ids": ["p2", "p4", "p9"]
    },
    "context_completeness": {
      "status": "present",
      "rationale": "It provides a comparison period, response count, cost estimate, survey limitation, and a future review point that help readers judge the decision.",
      "paragraph_ids": ["p2", "p3", "p5", "p7", "p8"]
    },
    "framing_uncertainty_separation": {
      "status": "present",
      "rationale": "Reported figures, attributed judgments, and unresolved causal uncertainty remain clearly separated throughout the article.",
      "paragraph_ids": ["p2", "p4", "p6", "p7", "p9"]
    }
  },
  "issues": [
    {
      "type": "selection_ambiguity",
      "severity": "low",
      "description": "The voluntary survey reached Saturday library visitors, so its results may not represent residents who did not use the library on weekends.",
      "paragraph_ids": ["p3", "p7"]
    }
  ],
  "bounded_conclusion": "Assuming the reported figures and statements are accurate, Saturday visits rose during the pilot, most survey respondents favored later hours, and city officials chose to continue the schedule while planning another review. The article does not establish that later hours alone caused the increase or that the survey represents all residents.",
  "structural_assessment": {
    "evidence_structure": "structurally_solid",
    "presentation_style": "restrained",
    "one_sentence": "The article supports its main takeaway with identifiable records, survey results, costs, and follow-up plans while keeping the evidence's limits visible."
  }
}
